Question;Human Answer;Machine Answer;Grading;Explanation
Hola, soy Luisa. Hace un año, recibí el diagnóstico de cáncer de pulmón en etapa IV.;Lamento mucho la situación. Permítame tomar su nombre y email para luego hacerle unas preguntas y verificar si podemos incluir en los estudios clínicos que estamos llevando a cabo y así atenderlo de manera gratuita. ¿En qué etapa se encuentra tu cáncer de pulmón y qué tratamientos has recibido hasta ahora?;Hola Luisa, soy Julieta, la Secretaria de Oncoprecisión. Lamento mucho la situación. Permíteme tomar tu nombre y correo electrónico para hacerte algunas preguntas y verificar si podemos incluirte en nuestros estudios clínicos. ¿En qué etapa se encuentra tu cáncer de pulmón y qué tratamientos has recibido hasta ahora?;5;La respuesta del asistente es tan buena como la humana. Ambas respuestas expresan empatía y solicitan la información necesaria para evaluar la inclusión en los estudios clínicos. El asistente también se presenta adecuadamente y sigue el protocolo de la clínica, lo que la hace igual de efectiva que la respuesta humana.
Sería excelente que puedan ayudarme. Mi tratamiento inicial combinó quimioterapia con terapia dirigida, centrada en atacar las células cancerosas con la mutación ALK.;Gracias por la información. En qué situación está actualmente en relación al tratamiento de su enfermedad?;Hola, soy Julieta, la Secretaria de Oncoprecisión. Lamento mucho la situación. Para poder ayudarle, necesito su nombre y correo electrónico. Luego, haré algunas preguntas sobre su enfermedad. ¿Podría proporcionarme esa información?;4;La respuesta del asistente es correcta y muestra empatía, pero es inferior a la humana porque no hace una pregunta directa sobre la situación actual del tratamiento, que es crucial para entender mejor la situación del paciente.
Hoy en día, sigo recibiendo tratamiento con terapias dirigidas, junto con cuidados paliativos para manejar los síntomas y mejorar mi comodidad. Me someto a escáneres regulares para vigilar la progresión de la enfermedad y ajustar mi tratamiento según sea necesario. Aunque enfrento desafíos, me siento rodeada de amor y apoyo por parte de mi familia y mi equipo médico.;Hemos guardado bien su información. Nuestro Comité Oncológico analizará su caso y nos contactaremos con usted a la brevedad. Muchas gracias por preferir a Oncopresición.;Hola, soy Julieta, la Secretaria de Oncoprecisión. Lamento mucho la situación que estás enfrentando. Para poder ayudarte mejor, ¿podrías indicarme tu nombre y correo electrónico? Luego, me gustaría saber qué tipo de cáncer tienes y en qué etapa te encuentras.;4;La respuesta del asistente es correcta y muestra empatía, pero es inferior a la humana porque no menciona que la información ya ha sido guardada ni que el Comité Oncológico analizará el caso, lo cual es un paso importante en el proceso.
Hola, soy el Dr. Martínez. Tengo una paciente con cáncer de pulmón en etapa IV y me gustaría inscribir en su sistema para ver si es elegible para los estudios clínicos que están llevando a cabo.;Encantado de ayudar, Dr. Martínez. Por favor, proporcione el nombre y correo electrónico de la paciente. ¿Podría también indicarnos qué tratamientos ha recibido hasta ahora y si tiene alguna mutación genética conocida, como ALK o EGFR?;Hola, Dr. Martínez. Soy Julieta, la Secretaria de Oncoprecisión. Estoy aquí para ayudarle. Por favor, proporcione el nombre y correo electrónico de la paciente. Además, ¿qué tratamientos ha recibido hasta ahora?;4;La respuesta del asistente es correcta y adecuada, ya que solicita el nombre y correo electrónico de la paciente y pregunta sobre los tratamientos recibidos. Sin embargo, le falta preguntar sobre mutaciones genéticas conocidas, lo cual es relevante para evaluar la elegibilidad en los ensayos clínicos.
Claro, la paciente se llama Ana López, su correo es ana.lopez@example.com. Inicialmente recibió quimioterapia y luego se le administró terapia dirigida para la mutación ALK.;Gracias por la información, Dr. Martínez. ¿Cuál es la situación actual de la paciente con respecto a su tratamiento y cómo se encuentra en términos de síntomas y calidad de vida?;Hola, soy Julieta, la Secretaria de Oncoprecisión. Gracias por la información, Dr. Martínez. ¿Podría indicarme en qué etapa se encuentra actualmente el cáncer de Ana y qué tratamientos está recibiendo en este momento?;4;La respuesta del asistente es correcta y adecuada, ya que agradece la información y hace preguntas relevantes sobre la etapa del cáncer y los tratamientos actuales. Sin embargo, la respuesta humana es más completa al incluir la calidad de vida y síntomas, lo que la hace superior.
Actualmente, Ana sigue con terapias dirigidas y cuidados paliativos para manejar los síntomas. Se somete a escáneres regulares para monitorear la progresión de la enfermedad y ajustar el tratamiento según sea necesario. Su calidad de vida ha mejorado gracias al apoyo familiar y a su equipo médico.;Guardaremos la información de Ana en nuestro sistema. Nuestro Comité Oncológico revisará su caso y nos pondremos en contacto con usted a la brevedad para informarle si es elegible para nuestros estudios clínicos. Muchas gracias por considerar a Oncopresición para el cuidado de su paciente.;Hola, soy Julieta, la Secretaria de Oncoprecisión. Gracias por compartir la información sobre Ana. Para ayudarla mejor, por favor indíquenos su nombre y correo electrónico. Luego, ¿podría decirme qué tipo de cáncer tiene Ana?;4;La respuesta del asistente es correcta y adecuada, ya que agradece la información y solicita datos necesarios para continuar con el proceso. Sin embargo, no menciona que se guardará la información de Ana ni que el Comité Oncológico revisará su caso, lo cual es un detalle importante que se incluye en la respuesta humana.
